<?xml version='1.0' encoding='utf-8'?>
<!DOCTYPE list SYSTEM "zone.dtd">
<list>
    <zone name="[liberation_fortress]" type="custom">
        <set name="enabled" val="false"/>
        <polygon>
            <coords loc="180224 -19584"/>
            <coords loc="179712 -14208"/>
            <coords loc="176128 -14080"/>
            <coords loc="175744 -19968"/>
        </polygon>
    </zone>
</list>