<?xml version='1.0' encoding='utf-8'?>
<!DOCTYPE list SYSTEM "zone.dtd">
<list>

	<zone name="[Pvpevemt]" type="battle_zone" >
		<set name="enabled" value="true"/>
		<set name="entering_message_no" value="283"/>
		<set name="leaving_message_no" value="284"/>
		<polygon>
			<coords loc="217512 73128 944 47211"/>
			<coords loc="216968 73160 928 48926"/>
			<coords loc="216840 72808 960 59707"/>
			<coords loc="216824 72392 1040 60649"/>
			<coords loc="216888 72072 1032 19870"/>
			<coords loc="216744 71608 1048 58989"/>
			<coords loc="216824 71288 1056 57314"/>
			<coords loc="216968 70856 1104 2592"/>
			<coords loc="217208 70632 1184 26394"/>
			<coords loc="217736 70920 1224 41579"/>
			<coords loc="218216 71320 1136 19912"/>
			<coords loc="218232 71848 1048 26901"/>
			<coords loc="218136 72216 1048 36393"/>
			<coords loc="217848 72984 944 42627"/>
		</polygon>
	</zone>

</list>